
*** Running vivado
    with args -log dvi_pass_top.vdi -applog -m64 -product Vivado -messageDb vivado.pb -mode batch -source dvi_pass_top.tcl -notrace



****** Vivado v2020.2 (64-bit)
  **** SW Build 3064766 on Wed Nov 18 09:12:45 MST 2020
  **** IP Build 3064653 on Wed Nov 18 14:17:31 MST 2020
    ** Copyright 1986-2020 Xilinx, Inc. All Rights Reserved.

source dvi_pass_top.tcl -notrace
INFO: [IP_Flow 19-234] Refreshing IP repositories
INFO: [IP_Flow 19-1700] Loaded user IP repository 'c:/Users/robdj/Documents/RMIT_2021/CAP_STONE/DIGILENT_LIB/vivado-library-master'.
INFO: [IP_Flow 19-2313] Loaded Vivado IP repository 'C:/Xilinx/Vivado/2020.2/data/ip'.
WARNING: [IP_Flow 19-4995] The host OS only allows 260 characters in a normal path. The IP cache path is more than 80 characters. If you experience issues with IP caching, please consider changing the IP cache to a location with a shorter path. Alternately consider using the OS subst command to map part of the path to a drive letter. 
Current IP cache path is C:/Users/robdj/Documents/RMIT_2021/CAP_STONE/DVI_PASSTHROUGH_CAPS/Working_HDMI_passthrough/Working_HDMI_passthrough.cache/ip 
Command: link_design -top dvi_pass_top -part xc7z020clg400-1
Design is defaulting to srcset: sources_1
Design is defaulting to constrset: constrs_1
INFO: [Device 21-403] Loading part xc7z020clg400-1
INFO: [Project 1-454] Reading design checkpoint 'c:/Users/robdj/Documents/RMIT_2021/CAP_STONE/DVI_PASSTHROUGH_CAPS/Working_HDMI_passthrough/Working_HDMI_passthrough.gen/sources_1/ip/clk_wiz_125M_200M/clk_wiz_125M_200M.dcp' for cell 'clkwiz_inst'
INFO: [Project 1-454] Reading design checkpoint 'c:/Users/robdj/Documents/RMIT_2021/CAP_STONE/DVI_PASSTHROUGH_CAPS/Working_HDMI_passthrough/Working_HDMI_passthrough.gen/sources_1/ip/dvi2rgb_1/dvi2rgb_1.dcp' for cell 'dvi2rgb_inst'
INFO: [Project 1-454] Reading design checkpoint 'c:/Users/robdj/Documents/RMIT_2021/CAP_STONE/DVI_PASSTHROUGH_CAPS/Working_HDMI_passthrough/Working_HDMI_passthrough.gen/sources_1/ip/rgb2dvi_0/rgb2dvi_0.dcp' for cell 'rgb2dvi_inst'
Netlist sorting complete. Time (s): cpu = 00:00:00 ; elapsed = 00:00:00.013 . Memory (MB): peak = 1113.312 ; gain = 0.000
INFO: [Netlist 29-17] Analyzing 73 Unisim elements for replacement
INFO: [Netlist 29-28] Unisim Transformation completed in 0 CPU seconds
INFO: [Project 1-479] Netlist was created with Vivado 2020.2
INFO: [Project 1-570] Preparing netlist for logic optimization
Parsing XDC File [c:/Users/robdj/Documents/RMIT_2021/CAP_STONE/DVI_PASSTHROUGH_CAPS/Working_HDMI_passthrough/Working_HDMI_passthrough.gen/sources_1/ip/rgb2dvi_0/src/rgb2dvi.xdc] for cell 'rgb2dvi_inst/U0'
Finished Parsing XDC File [c:/Users/robdj/Documents/RMIT_2021/CAP_STONE/DVI_PASSTHROUGH_CAPS/Working_HDMI_passthrough/Working_HDMI_passthrough.gen/sources_1/ip/rgb2dvi_0/src/rgb2dvi.xdc] for cell 'rgb2dvi_inst/U0'
Parsing XDC File [c:/Users/robdj/Documents/RMIT_2021/CAP_STONE/DVI_PASSTHROUGH_CAPS/Working_HDMI_passthrough/Working_HDMI_passthrough.gen/sources_1/ip/clk_wiz_125M_200M/clk_wiz_125M_200M_board.xdc] for cell 'clkwiz_inst/inst'
Finished Parsing XDC File [c:/Users/robdj/Documents/RMIT_2021/CAP_STONE/DVI_PASSTHROUGH_CAPS/Working_HDMI_passthrough/Working_HDMI_passthrough.gen/sources_1/ip/clk_wiz_125M_200M/clk_wiz_125M_200M_board.xdc] for cell 'clkwiz_inst/inst'
Parsing XDC File [c:/Users/robdj/Documents/RMIT_2021/CAP_STONE/DVI_PASSTHROUGH_CAPS/Working_HDMI_passthrough/Working_HDMI_passthrough.gen/sources_1/ip/clk_wiz_125M_200M/clk_wiz_125M_200M.xdc] for cell 'clkwiz_inst/inst'
INFO: [Timing 38-35] Done setting XDC timing constraints. [c:/Users/robdj/Documents/RMIT_2021/CAP_STONE/DVI_PASSTHROUGH_CAPS/Working_HDMI_passthrough/Working_HDMI_passthrough.gen/sources_1/ip/clk_wiz_125M_200M/clk_wiz_125M_200M.xdc:57]
INFO: [Timing 38-2] Deriving generated clocks [c:/Users/robdj/Documents/RMIT_2021/CAP_STONE/DVI_PASSTHROUGH_CAPS/Working_HDMI_passthrough/Working_HDMI_passthrough.gen/sources_1/ip/clk_wiz_125M_200M/clk_wiz_125M_200M.xdc:57]
get_clocks: Time (s): cpu = 00:00:08 ; elapsed = 00:00:08 . Memory (MB): peak = 1586.973 ; gain = 473.660
Finished Parsing XDC File [c:/Users/robdj/Documents/RMIT_2021/CAP_STONE/DVI_PASSTHROUGH_CAPS/Working_HDMI_passthrough/Working_HDMI_passthrough.gen/sources_1/ip/clk_wiz_125M_200M/clk_wiz_125M_200M.xdc] for cell 'clkwiz_inst/inst'
CRITICAL WARNING: [Designutils 20-1280] Could not find module 'ila_refclk'. The XDC file c:/Users/robdj/Documents/RMIT_2021/CAP_STONE/DVI_PASSTHROUGH_CAPS/Working_HDMI_passthrough/Working_HDMI_passthrough.gen/sources_1/ip/dvi2rgb_1/src/ila_refclk/ila_v6_2/constraints/ila.xdc will not be read for any cell of this module.
CRITICAL WARNING: [Designutils 20-1280] Could not find module 'ila_pixclk'. The XDC file c:/Users/robdj/Documents/RMIT_2021/CAP_STONE/DVI_PASSTHROUGH_CAPS/Working_HDMI_passthrough/Working_HDMI_passthrough.gen/sources_1/ip/dvi2rgb_1/src/ila_pixclk/ila_v6_2/constraints/ila.xdc will not be read for any cell of this module.
Parsing XDC File [c:/Users/robdj/Documents/RMIT_2021/CAP_STONE/DVI_PASSTHROUGH_CAPS/Working_HDMI_passthrough/Working_HDMI_passthrough.gen/sources_1/ip/dvi2rgb_1/src/dvi2rgb.xdc] for cell 'dvi2rgb_inst/U0'
Finished Parsing XDC File [c:/Users/robdj/Documents/RMIT_2021/CAP_STONE/DVI_PASSTHROUGH_CAPS/Working_HDMI_passthrough/Working_HDMI_passthrough.gen/sources_1/ip/dvi2rgb_1/src/dvi2rgb.xdc] for cell 'dvi2rgb_inst/U0'
Parsing XDC File [C:/Users/robdj/Documents/RMIT_2021/CAP_STONE/DVI_PASSTHROUGH_CAPS/Working_HDMI_passthrough/Working_HDMI_passthrough.srcs/constrs_1/imports/digilent-xdc-master/Arty-Z7-20-Master.xdc]
WARNING: [Vivado 12-584] No ports matched 'sw2'. [C:/Users/robdj/Documents/RMIT_2021/CAP_STONE/DVI_PASSTHROUGH_CAPS/Working_HDMI_passthrough/Working_HDMI_passthrough.srcs/constrs_1/imports/digilent-xdc-master/Arty-Z7-20-Master.xdc:14]
CRITICAL WARNING: [Common 17-55] 'set_property' expects at least one object. [C:/Users/robdj/Documents/RMIT_2021/CAP_STONE/DVI_PASSTHROUGH_CAPS/Working_HDMI_passthrough/Working_HDMI_passthrough.srcs/constrs_1/imports/digilent-xdc-master/Arty-Z7-20-Master.xdc:14]
Resolution: If [get_<value>] was used to populate the object, check to make sure this command returns at least one valid object.
WARNING: [Vivado 12-584] No ports matched 'led0'. [C:/Users/robdj/Documents/RMIT_2021/CAP_STONE/DVI_PASSTHROUGH_CAPS/Working_HDMI_passthrough/Working_HDMI_passthrough.srcs/constrs_1/imports/digilent-xdc-master/Arty-Z7-20-Master.xdc:25]
CRITICAL WARNING: [Common 17-55] 'set_property' expects at least one object. [C:/Users/robdj/Documents/RMIT_2021/CAP_STONE/DVI_PASSTHROUGH_CAPS/Working_HDMI_passthrough/Working_HDMI_passthrough.srcs/constrs_1/imports/digilent-xdc-master/Arty-Z7-20-Master.xdc:25]
Resolution: If [get_<value>] was used to populate the object, check to make sure this command returns at least one valid object.
WARNING: [Vivado 12-584] No ports matched 'led1'. [C:/Users/robdj/Documents/RMIT_2021/CAP_STONE/DVI_PASSTHROUGH_CAPS/Working_HDMI_passthrough/Working_HDMI_passthrough.srcs/constrs_1/imports/digilent-xdc-master/Arty-Z7-20-Master.xdc:26]
CRITICAL WARNING: [Common 17-55] 'set_property' expects at least one object. [C:/Users/robdj/Documents/RMIT_2021/CAP_STONE/DVI_PASSTHROUGH_CAPS/Working_HDMI_passthrough/Working_HDMI_passthrough.srcs/constrs_1/imports/digilent-xdc-master/Arty-Z7-20-Master.xdc:26]
Resolution: If [get_<value>] was used to populate the object, check to make sure this command returns at least one valid object.
WARNING: [Vivado 12-584] No ports matched 'led2'. [C:/Users/robdj/Documents/RMIT_2021/CAP_STONE/DVI_PASSTHROUGH_CAPS/Working_HDMI_passthrough/Working_HDMI_passthrough.srcs/constrs_1/imports/digilent-xdc-master/Arty-Z7-20-Master.xdc:27]
CRITICAL WARNING: [Common 17-55] 'set_property' expects at least one object. [C:/Users/robdj/Documents/RMIT_2021/CAP_STONE/DVI_PASSTHROUGH_CAPS/Working_HDMI_passthrough/Working_HDMI_passthrough.srcs/constrs_1/imports/digilent-xdc-master/Arty-Z7-20-Master.xdc:27]
Resolution: If [get_<value>] was used to populate the object, check to make sure this command returns at least one valid object.
WARNING: [Vivado 12-584] No ports matched 'led3'. [C:/Users/robdj/Documents/RMIT_2021/CAP_STONE/DVI_PASSTHROUGH_CAPS/Working_HDMI_passthrough/Working_HDMI_passthrough.srcs/constrs_1/imports/digilent-xdc-master/Arty-Z7-20-Master.xdc:28]
CRITICAL WARNING: [Common 17-55] 'set_property' expects at least one object. [C:/Users/robdj/Documents/RMIT_2021/CAP_STONE/DVI_PASSTHROUGH_CAPS/Working_HDMI_passthrough/Working_HDMI_passthrough.srcs/constrs_1/imports/digilent-xdc-master/Arty-Z7-20-Master.xdc:28]
Resolution: If [get_<value>] was used to populate the object, check to make sure this command returns at least one valid object.
WARNING: [Vivado 12-584] No ports matched 'hdmi_rx_cec'. [C:/Users/robdj/Documents/RMIT_2021/CAP_STONE/DVI_PASSTHROUGH_CAPS/Working_HDMI_passthrough/Working_HDMI_passthrough.srcs/constrs_1/imports/digilent-xdc-master/Arty-Z7-20-Master.xdc:64]
CRITICAL WARNING: [Common 17-55] 'set_property' expects at least one object. [C:/Users/robdj/Documents/RMIT_2021/CAP_STONE/DVI_PASSTHROUGH_CAPS/Working_HDMI_passthrough/Working_HDMI_passthrough.srcs/constrs_1/imports/digilent-xdc-master/Arty-Z7-20-Master.xdc:64]
Resolution: If [get_<value>] was used to populate the object, check to make sure this command returns at least one valid object.
WARNING: [Vivado 12-584] No ports matched 'hdmi_tx_cec'. [C:/Users/robdj/Documents/RMIT_2021/CAP_STONE/DVI_PASSTHROUGH_CAPS/Working_HDMI_passthrough/Working_HDMI_passthrough.srcs/constrs_1/imports/digilent-xdc-master/Arty-Z7-20-Master.xdc:78]
CRITICAL WARNING: [Common 17-55] 'set_property' expects at least one object. [C:/Users/robdj/Documents/RMIT_2021/CAP_STONE/DVI_PASSTHROUGH_CAPS/Working_HDMI_passthrough/Working_HDMI_passthrough.srcs/constrs_1/imports/digilent-xdc-master/Arty-Z7-20-Master.xdc:78]
Resolution: If [get_<value>] was used to populate the object, check to make sure this command returns at least one valid object.
WARNING: [Vivado 12-584] No ports matched 'hdmi_tx_hpdn'. [C:/Users/robdj/Documents/RMIT_2021/CAP_STONE/DVI_PASSTHROUGH_CAPS/Working_HDMI_passthrough/Working_HDMI_passthrough.srcs/constrs_1/imports/digilent-xdc-master/Arty-Z7-20-Master.xdc:87]
CRITICAL WARNING: [Common 17-55] 'set_property' expects at least one object. [C:/Users/robdj/Documents/RMIT_2021/CAP_STONE/DVI_PASSTHROUGH_CAPS/Working_HDMI_passthrough/Working_HDMI_passthrough.srcs/constrs_1/imports/digilent-xdc-master/Arty-Z7-20-Master.xdc:87]
Resolution: If [get_<value>] was used to populate the object, check to make sure this command returns at least one valid object.
WARNING: [Vivado 12-584] No ports matched 'hdmi_tx_scl'. [C:/Users/robdj/Documents/RMIT_2021/CAP_STONE/DVI_PASSTHROUGH_CAPS/Working_HDMI_passthrough/Working_HDMI_passthrough.srcs/constrs_1/imports/digilent-xdc-master/Arty-Z7-20-Master.xdc:88]
CRITICAL WARNING: [Common 17-55] 'set_property' expects at least one object. [C:/Users/robdj/Documents/RMIT_2021/CAP_STONE/DVI_PASSTHROUGH_CAPS/Working_HDMI_passthrough/Working_HDMI_passthrough.srcs/constrs_1/imports/digilent-xdc-master/Arty-Z7-20-Master.xdc:88]
Resolution: If [get_<value>] was used to populate the object, check to make sure this command returns at least one valid object.
WARNING: [Vivado 12-584] No ports matched 'hdmi_tx_sda'. [C:/Users/robdj/Documents/RMIT_2021/CAP_STONE/DVI_PASSTHROUGH_CAPS/Working_HDMI_passthrough/Working_HDMI_passthrough.srcs/constrs_1/imports/digilent-xdc-master/Arty-Z7-20-Master.xdc:89]
CRITICAL WARNING: [Common 17-55] 'set_property' expects at least one object. [C:/Users/robdj/Documents/RMIT_2021/CAP_STONE/DVI_PASSTHROUGH_CAPS/Working_HDMI_passthrough/Working_HDMI_passthrough.srcs/constrs_1/imports/digilent-xdc-master/Arty-Z7-20-Master.xdc:89]
Resolution: If [get_<value>] was used to populate the object, check to make sure this command returns at least one valid object.
WARNING: [Vivado 12-507] No nets matched 'led2_OBUF'. [C:/Users/robdj/Documents/RMIT_2021/CAP_STONE/DVI_PASSTHROUGH_CAPS/Working_HDMI_passthrough/Working_HDMI_passthrough.srcs/constrs_1/imports/digilent-xdc-master/Arty-Z7-20-Master.xdc:189]
CRITICAL WARNING: [Common 17-55] 'set_property' expects at least one object. [C:/Users/robdj/Documents/RMIT_2021/CAP_STONE/DVI_PASSTHROUGH_CAPS/Working_HDMI_passthrough/Working_HDMI_passthrough.srcs/constrs_1/imports/digilent-xdc-master/Arty-Z7-20-Master.xdc:189]
Resolution: If [get_<value>] was used to populate the object, check to make sure this command returns at least one valid object.
WARNING: [Vivado 12-507] No nets matched 'led_control/fade_up_down/cnt[0]'. [C:/Users/robdj/Documents/RMIT_2021/CAP_STONE/DVI_PASSTHROUGH_CAPS/Working_HDMI_passthrough/Working_HDMI_passthrough.srcs/constrs_1/imports/digilent-xdc-master/Arty-Z7-20-Master.xdc:190]
CRITICAL WARNING: [Common 17-55] 'set_property' expects at least one object. [C:/Users/robdj/Documents/RMIT_2021/CAP_STONE/DVI_PASSTHROUGH_CAPS/Working_HDMI_passthrough/Working_HDMI_passthrough.srcs/constrs_1/imports/digilent-xdc-master/Arty-Z7-20-Master.xdc:190]
Resolution: If [get_<value>] was used to populate the object, check to make sure this command returns at least one valid object.
WARNING: [Vivado 12-507] No nets matched 'led_control/fade_up_down/cnt[1]'. [C:/Users/robdj/Documents/RMIT_2021/CAP_STONE/DVI_PASSTHROUGH_CAPS/Working_HDMI_passthrough/Working_HDMI_passthrough.srcs/constrs_1/imports/digilent-xdc-master/Arty-Z7-20-Master.xdc:191]
CRITICAL WARNING: [Common 17-55] 'set_property' expects at least one object. [C:/Users/robdj/Documents/RMIT_2021/CAP_STONE/DVI_PASSTHROUGH_CAPS/Working_HDMI_passthrough/Working_HDMI_passthrough.srcs/constrs_1/imports/digilent-xdc-master/Arty-Z7-20-Master.xdc:191]
Resolution: If [get_<value>] was used to populate the object, check to make sure this command returns at least one valid object.
WARNING: [Vivado 12-507] No nets matched 'led_control/fade_up_down/cnt[2]'. [C:/Users/robdj/Documents/RMIT_2021/CAP_STONE/DVI_PASSTHROUGH_CAPS/Working_HDMI_passthrough/Working_HDMI_passthrough.srcs/constrs_1/imports/digilent-xdc-master/Arty-Z7-20-Master.xdc:192]
CRITICAL WARNING: [Common 17-55] 'set_property' expects at least one object. [C:/Users/robdj/Documents/RMIT_2021/CAP_STONE/DVI_PASSTHROUGH_CAPS/Working_HDMI_passthrough/Working_HDMI_passthrough.srcs/constrs_1/imports/digilent-xdc-master/Arty-Z7-20-Master.xdc:192]
Resolution: If [get_<value>] was used to populate the object, check to make sure this command returns at least one valid object.
WARNING: [Vivado 12-507] No nets matched 'led_control/fade_up_down/cnt[3]'. [C:/Users/robdj/Documents/RMIT_2021/CAP_STONE/DVI_PASSTHROUGH_CAPS/Working_HDMI_passthrough/Working_HDMI_passthrough.srcs/constrs_1/imports/digilent-xdc-master/Arty-Z7-20-Master.xdc:193]
CRITICAL WARNING: [Common 17-55] 'set_property' expects at least one object. [C:/Users/robdj/Documents/RMIT_2021/CAP_STONE/DVI_PASSTHROUGH_CAPS/Working_HDMI_passthrough/Working_HDMI_passthrough.srcs/constrs_1/imports/digilent-xdc-master/Arty-Z7-20-Master.xdc:193]
Resolution: If [get_<value>] was used to populate the object, check to make sure this command returns at least one valid object.
WARNING: [Vivado 12-507] No nets matched 'led_control/fade_up_down/cnt[4]'. [C:/Users/robdj/Documents/RMIT_2021/CAP_STONE/DVI_PASSTHROUGH_CAPS/Working_HDMI_passthrough/Working_HDMI_passthrough.srcs/constrs_1/imports/digilent-xdc-master/Arty-Z7-20-Master.xdc:194]
CRITICAL WARNING: [Common 17-55] 'set_property' expects at least one object. [C:/Users/robdj/Documents/RMIT_2021/CAP_STONE/DVI_PASSTHROUGH_CAPS/Working_HDMI_passthrough/Working_HDMI_passthrough.srcs/constrs_1/imports/digilent-xdc-master/Arty-Z7-20-Master.xdc:194]
Resolution: If [get_<value>] was used to populate the object, check to make sure this command returns at least one valid object.
WARNING: [Vivado 12-507] No nets matched 'led_control/fade_up_down/cnt[5]'. [C:/Users/robdj/Documents/RMIT_2021/CAP_STONE/DVI_PASSTHROUGH_CAPS/Working_HDMI_passthrough/Working_HDMI_passthrough.srcs/constrs_1/imports/digilent-xdc-master/Arty-Z7-20-Master.xdc:195]
CRITICAL WARNING: [Common 17-55] 'set_property' expects at least one object. [C:/Users/robdj/Documents/RMIT_2021/CAP_STONE/DVI_PASSTHROUGH_CAPS/Working_HDMI_passthrough/Working_HDMI_passthrough.srcs/constrs_1/imports/digilent-xdc-master/Arty-Z7-20-Master.xdc:195]
Resolution: If [get_<value>] was used to populate the object, check to make sure this command returns at least one valid object.
WARNING: [Vivado 12-507] No nets matched 'led_control/fade_up_down/cnt[6]'. [C:/Users/robdj/Documents/RMIT_2021/CAP_STONE/DVI_PASSTHROUGH_CAPS/Working_HDMI_passthrough/Working_HDMI_passthrough.srcs/constrs_1/imports/digilent-xdc-master/Arty-Z7-20-Master.xdc:196]
CRITICAL WARNING: [Common 17-55] 'set_property' expects at least one object. [C:/Users/robdj/Documents/RMIT_2021/CAP_STONE/DVI_PASSTHROUGH_CAPS/Working_HDMI_passthrough/Working_HDMI_passthrough.srcs/constrs_1/imports/digilent-xdc-master/Arty-Z7-20-Master.xdc:196]
Resolution: If [get_<value>] was used to populate the object, check to make sure this command returns at least one valid object.
WARNING: [Vivado 12-507] No nets matched 'led_control/fade_up_down/cnt[7]'. [C:/Users/robdj/Documents/RMIT_2021/CAP_STONE/DVI_PASSTHROUGH_CAPS/Working_HDMI_passthrough/Working_HDMI_passthrough.srcs/constrs_1/imports/digilent-xdc-master/Arty-Z7-20-Master.xdc:197]
CRITICAL WARNING: [Common 17-55] 'set_property' expects at least one object. [C:/Users/robdj/Documents/RMIT_2021/CAP_STONE/DVI_PASSTHROUGH_CAPS/Working_HDMI_passthrough/Working_HDMI_passthrough.srcs/constrs_1/imports/digilent-xdc-master/Arty-Z7-20-Master.xdc:197]
Resolution: If [get_<value>] was used to populate the object, check to make sure this command returns at least one valid object.
Finished Parsing XDC File [C:/Users/robdj/Documents/RMIT_2021/CAP_STONE/DVI_PASSTHROUGH_CAPS/Working_HDMI_passthrough/Working_HDMI_passthrough.srcs/constrs_1/imports/digilent-xdc-master/Arty-Z7-20-Master.xdc]
Parsing XDC File [c:/Users/robdj/Documents/RMIT_2021/CAP_STONE/DVI_PASSTHROUGH_CAPS/Working_HDMI_passthrough/Working_HDMI_passthrough.gen/sources_1/ip/rgb2dvi_0/src/rgb2dvi_clocks.xdc] for cell 'rgb2dvi_inst/U0'
Finished Parsing XDC File [c:/Users/robdj/Documents/RMIT_2021/CAP_STONE/DVI_PASSTHROUGH_CAPS/Working_HDMI_passthrough/Working_HDMI_passthrough.gen/sources_1/ip/rgb2dvi_0/src/rgb2dvi_clocks.xdc] for cell 'rgb2dvi_inst/U0'
Parsing XDC File [c:/Users/robdj/Documents/RMIT_2021/CAP_STONE/DVI_PASSTHROUGH_CAPS/Working_HDMI_passthrough/Working_HDMI_passthrough.gen/sources_1/ip/dvi2rgb_1/src/ila_timing_workaround.xdc] for cell 'dvi2rgb_inst/U0'
Finished Parsing XDC File [c:/Users/robdj/Documents/RMIT_2021/CAP_STONE/DVI_PASSTHROUGH_CAPS/Working_HDMI_passthrough/Working_HDMI_passthrough.gen/sources_1/ip/dvi2rgb_1/src/ila_timing_workaround.xdc] for cell 'dvi2rgb_inst/U0'
INFO: [Opt 31-138] Pushed 0 inverter(s) to 0 load pin(s).
INFO: [Project 1-1687] 12 scoped IP constraints or related sub-commands were skipped due to synthesis logic optimizations usually triggered by constant connectivity or unconnected output pins. To review the skipped constraints and messages, run the command 'set_param netlist.IPMsgFiltering false' before opening the design.
Netlist sorting complete. Time (s): cpu = 00:00:00 ; elapsed = 00:00:00.001 . Memory (MB): peak = 1586.973 ; gain = 0.000
INFO: [Project 1-111] Unisim Transformation Summary:
  A total of 8 instances were transformed.
  IOBUF => IOBUF (IBUF, OBUFT): 2 instances
  RAM32M => RAM32M (RAMD32(x6), RAMS32(x2)): 6 instances

16 Infos, 20 Warnings, 21 Critical Warnings and 0 Errors encountered.
link_design completed successfully
link_design: Time (s): cpu = 00:00:16 ; elapsed = 00:00:18 . Memory (MB): peak = 1586.973 ; gain = 473.660
Command: opt_design
Attempting to get a license for feature 'Implementation' and/or device 'xc7z020'
INFO: [Common 17-349] Got license for feature 'Implementation' and/or device 'xc7z020'
Running DRC as a precondition to command opt_design

Starting DRC Task
INFO: [DRC 23-27] Running DRC with 2 threads
INFO: [Project 1-461] DRC finished with 0 Errors
INFO: [Project 1-462] Please refer to the DRC report (report_drc) for more information.

Time (s): cpu = 00:00:02 ; elapsed = 00:00:01 . Memory (MB): peak = 1586.973 ; gain = 0.000

Starting Cache Timing Information Task
INFO: [Timing 38-35] Done setting XDC timing constraints.
INFO: [Timing 38-2] Deriving generated clocks
Ending Cache Timing Information Task | Checksum: 20f773d0c

Time (s): cpu = 00:00:01 ; elapsed = 00:00:00.059 . Memory (MB): peak = 1608.430 ; gain = 21.457

Starting Logic Optimization Task

Phase 1 Retarget
INFO: [Opt 31-138] Pushed 0 inverter(s) to 0 load pin(s).
INFO: [Opt 31-49] Retargeted 0 cell(s).
Phase 1 Retarget | Checksum: 1a15ec841

Time (s): cpu = 00:00:00 ; elapsed = 00:00:00.110 . Memory (MB): peak = 1806.031 ; gain = 0.000
INFO: [Opt 31-389] Phase Retarget created 3 cells and removed 9 cells
INFO: [Opt 31-1021] In phase Retarget, 5 netlist objects are constrained preventing optimization. Please run opt_design with -debug_log to get more detail. 

Phase 2 Constant propagation
INFO: [Opt 31-138] Pushed 0 inverter(s) to 0 load pin(s).
Phase 2 Constant propagation | Checksum: 1a15ec841

Time (s): cpu = 00:00:00 ; elapsed = 00:00:00.122 . Memory (MB): peak = 1806.031 ; gain = 0.000
INFO: [Opt 31-389] Phase Constant propagation created 0 cells and removed 0 cells

Phase 3 Sweep
Phase 3 Sweep | Checksum: 1a668ed00

Time (s): cpu = 00:00:00 ; elapsed = 00:00:00.150 . Memory (MB): peak = 1806.031 ; gain = 0.000
INFO: [Opt 31-389] Phase Sweep created 0 cells and removed 4 cells

Phase 4 BUFG optimization
Phase 4 BUFG optimization | Checksum: 1a668ed00

Time (s): cpu = 00:00:00 ; elapsed = 00:00:00.189 . Memory (MB): peak = 1806.031 ; gain = 0.000
INFO: [Opt 31-662] Phase BUFG optimization created 0 cells of which 0 are BUFGs and removed 0 cells.

Phase 5 Shift Register Optimization
INFO: [Opt 31-1064] SRL Remap converted 0 SRLs to 0 registers and converted 0 registers of register chains to 0 SRLs
Phase 5 Shift Register Optimization | Checksum: 1a668ed00

Time (s): cpu = 00:00:00 ; elapsed = 00:00:00.196 . Memory (MB): peak = 1806.031 ; gain = 0.000
INFO: [Opt 31-389] Phase Shift Register Optimization created 0 cells and removed 0 cells

Phase 6 Post Processing Netlist
Phase 6 Post Processing Netlist | Checksum: 1a668ed00

Time (s): cpu = 00:00:00 ; elapsed = 00:00:00.207 . Memory (MB): peak = 1806.031 ; gain = 0.000
INFO: [Opt 31-389] Phase Post Processing Netlist created 0 cells and removed 0 cells
Opt_design Change Summary
=========================


-------------------------------------------------------------------------------------------------------------------------
|  Phase                        |  #Cells created  |  #Cells Removed  |  #Constrained objects preventing optimizations  |
-------------------------------------------------------------------------------------------------------------------------
|  Retarget                     |               3  |               9  |                                              5  |
|  Constant propagation         |               0  |               0  |                                              0  |
|  Sweep                        |               0  |               4  |                                              0  |
|  BUFG optimization            |               0  |               0  |                                              0  |
|  Shift Register Optimization  |               0  |               0  |                                              0  |
|  Post Processing Netlist      |               0  |               0  |                                              0  |
-------------------------------------------------------------------------------------------------------------------------



Starting Connectivity Check Task

Time (s): cpu = 00:00:00 ; elapsed = 00:00:00.006 . Memory (MB): peak = 1806.031 ; gain = 0.000
Ending Logic Optimization Task | Checksum: 1683b3653

Time (s): cpu = 00:00:00 ; elapsed = 00:00:00.236 . Memory (MB): peak = 1806.031 ; gain = 0.000

Starting Power Optimization Task
INFO: [Pwropt 34-132] Skipping clock gating for clocks with a period < 2.00 ns.
Ending Power Optimization Task | Checksum: 1683b3653

Time (s): cpu = 00:00:00 ; elapsed = 00:00:00.018 . Memory (MB): peak = 1806.031 ; gain = 0.000

Starting Final Cleanup Task
Ending Final Cleanup Task | Checksum: 1683b3653

Time (s): cpu = 00:00:00 ; elapsed = 00:00:00 . Memory (MB): peak = 1806.031 ; gain = 0.000

Starting Netlist Obfuscation Task
Netlist sorting complete. Time (s): cpu = 00:00:00 ; elapsed = 00:00:00 . Memory (MB): peak = 1806.031 ; gain = 0.000
Ending Netlist Obfuscation Task | Checksum: 1683b3653

Time (s): cpu = 00:00:00 ; elapsed = 00:00:00.001 . Memory (MB): peak = 1806.031 ; gain = 0.000
INFO: [Common 17-83] Releasing license: Implementation
35 Infos, 20 Warnings, 21 Critical Warnings and 0 Errors encountered.
opt_design completed successfully
INFO: [Timing 38-35] Done setting XDC timing constraints.
INFO: [Timing 38-480] Writing timing data to binary archive.
Writing placer database...
Writing XDEF routing.
Writing XDEF routing logical nets.
Writing XDEF routing special nets.
Write XDEF Complete: Time (s): cpu = 00:00:01 ; elapsed = 00:00:00.082 . Memory (MB): peak = 1806.031 ; gain = 0.000
INFO: [Common 17-1381] The checkpoint 'C:/Users/robdj/Documents/RMIT_2021/CAP_STONE/DVI_PASSTHROUGH_CAPS/Working_HDMI_passthrough/Working_HDMI_passthrough.runs/impl_1/dvi_pass_top_opt.dcp' has been generated.
INFO: [runtcl-4] Executing : report_drc -file dvi_pass_top_drc_opted.rpt -pb dvi_pass_top_drc_opted.pb -rpx dvi_pass_top_drc_opted.rpx
Command: report_drc -file dvi_pass_top_drc_opted.rpt -pb dvi_pass_top_drc_opted.pb -rpx dvi_pass_top_drc_opted.rpx
INFO: [IP_Flow 19-1839] IP Catalog is up to date.
INFO: [DRC 23-27] Running DRC with 2 threads
INFO: [Coretcl 2-168] The results of DRC are in file C:/Users/robdj/Documents/RMIT_2021/CAP_STONE/DVI_PASSTHROUGH_CAPS/Working_HDMI_passthrough/Working_HDMI_passthrough.runs/impl_1/dvi_pass_top_drc_opted.rpt.
report_drc completed successfully
Command: place_design
Attempting to get a license for feature 'Implementation' and/or device 'xc7z020'
INFO: [Common 17-349] Got license for feature 'Implementation' and/or device 'xc7z020'
INFO: [DRC 23-27] Running DRC with 2 threads
INFO: [Vivado_Tcl 4-198] DRC finished with 0 Errors
INFO: [Vivado_Tcl 4-199] Please refer to the DRC report (report_drc) for more information.
Running DRC as a precondition to command place_design
INFO: [DRC 23-27] Running DRC with 2 threads
INFO: [Vivado_Tcl 4-198] DRC finished with 0 Errors
INFO: [Vivado_Tcl 4-199] Please refer to the DRC report (report_drc) for more information.

Starting Placer Task
INFO: [Place 30-611] Multithreading enabled for place_design using a maximum of 2 CPUs

Phase 1 Placer Initialization

Phase 1.1 Placer Initialization Netlist Sorting
Netlist sorting complete. Time (s): cpu = 00:00:00 ; elapsed = 00:00:00 . Memory (MB): peak = 1850.180 ; gain = 0.000
Phase 1.1 Placer Initialization Netlist Sorting | Checksum: dee3192d

Time (s): cpu = 00:00:00 ; elapsed = 00:00:00.011 . Memory (MB): peak = 1850.180 ; gain = 0.000
Netlist sorting complete. Time (s): cpu = 00:00:00 ; elapsed = 00:00:00 . Memory (MB): peak = 1850.180 ; gain = 0.000

Phase 1.2 IO Placement/ Clock Placement/ Build Placer Device
Phase 1.2 IO Placement/ Clock Placement/ Build Placer Device | Checksum: 15864becf

Time (s): cpu = 00:00:01 ; elapsed = 00:00:00.416 . Memory (MB): peak = 1850.180 ; gain = 0.000

Phase 1.3 Build Placer Netlist Model
Phase 1.3 Build Placer Netlist Model | Checksum: 24cf5c029

Time (s): cpu = 00:00:02 ; elapsed = 00:00:00.783 . Memory (MB): peak = 1850.180 ; gain = 0.000

Phase 1.4 Constrain Clocks/Macros
Phase 1.4 Constrain Clocks/Macros | Checksum: 24cf5c029

Time (s): cpu = 00:00:02 ; elapsed = 00:00:00.797 . Memory (MB): peak = 1850.180 ; gain = 0.000
Phase 1 Placer Initialization | Checksum: 24cf5c029

Time (s): cpu = 00:00:02 ; elapsed = 00:00:00.808 . Memory (MB): peak = 1850.180 ; gain = 0.000

Phase 2 Global Placement

Phase 2.1 Floorplanning
Phase 2.1 Floorplanning | Checksum: 173b20f51

Time (s): cpu = 00:00:02 ; elapsed = 00:00:00.923 . Memory (MB): peak = 1850.180 ; gain = 0.000

Phase 2.2 Update Timing before SLR Path Opt
Phase 2.2 Update Timing before SLR Path Opt | Checksum: 23f6d1714

Time (s): cpu = 00:00:02 ; elapsed = 00:00:00.981 . Memory (MB): peak = 1850.180 ; gain = 0.000

Phase 2.3 Global Placement Core

Phase 2.3.1 Physical Synthesis In Placer
INFO: [Physopt 32-1035] Found 0 LUTNM shape to break, 4 LUT instances to create LUTNM shape
INFO: [Physopt 32-1044] Break lutnm for timing: one critical 0, two critical 0, total 0, new lutff created 0
INFO: [Physopt 32-775] End 1 Pass. Optimized 2 nets or cells. Created 0 new cell, deleted 2 existing cells and moved 0 existing cell
INFO: [Physopt 32-65] No nets found for high-fanout optimization.
INFO: [Physopt 32-232] Optimized 0 net. Created 0 new instance.
INFO: [Physopt 32-775] End 1 Pass. Optimized 0 net or cell. Created 0 new cell, deleted 0 existing cell and moved 0 existing cell
INFO: [Physopt 32-456] No candidate cells for DSP register optimization found in the design.
INFO: [Physopt 32-775] End 2 Pass. Optimized 0 net or cell. Created 0 new cell, deleted 0 existing cell and moved 0 existing cell
INFO: [Physopt 32-1123] No candidate cells found for Shift Register to Pipeline optimization
INFO: [Physopt 32-775] End 1 Pass. Optimized 0 net or cell. Created 0 new cell, deleted 0 existing cell and moved 0 existing cell
INFO: [Physopt 32-677] No candidate cells for Shift Register optimization found in the design
INFO: [Physopt 32-775] End 1 Pass. Optimized 0 net or cell. Created 0 new cell, deleted 0 existing cell and moved 0 existing cell
INFO: [Physopt 32-526] No candidate cells for BRAM register optimization found in the design
INFO: [Physopt 32-775] End 1 Pass. Optimized 0 net or cell. Created 0 new cell, deleted 0 existing cell and moved 0 existing cell
INFO: [Physopt 32-846] No candidate cells for URAM register optimization found in the design
INFO: [Physopt 32-775] End 2 Pass. Optimized 0 net or cell. Created 0 new cell, deleted 0 existing cell and moved 0 existing cell
INFO: [Physopt 32-949] No candidate nets found for dynamic/static region interface net replication
INFO: [Physopt 32-775] End 1 Pass. Optimized 0 net or cell. Created 0 new cell, deleted 0 existing cell and moved 0 existing cell
Netlist sorting complete. Time (s): cpu = 00:00:00 ; elapsed = 00:00:00 . Memory (MB): peak = 1850.180 ; gain = 0.000

Summary of Physical Synthesis Optimizations
============================================


-----------------------------------------------------------------------------------------------------------------------------------------------------------
|  Optimization                                     |  Added Cells  |  Removed Cells  |  Optimized Cells/Nets  |  Dont Touch  |  Iterations  |  Elapsed   |
-----------------------------------------------------------------------------------------------------------------------------------------------------------
|  LUT Combining                                    |            0  |              2  |                     2  |           0  |           1  |  00:00:00  |
|  Very High Fanout                                 |            0  |              0  |                     0  |           0  |           1  |  00:00:00  |
|  DSP Register                                     |            0  |              0  |                     0  |           0  |           1  |  00:00:00  |
|  Shift Register to Pipeline                       |            0  |              0  |                     0  |           0  |           1  |  00:00:00  |
|  Shift Register                                   |            0  |              0  |                     0  |           0  |           1  |  00:00:00  |
|  BRAM Register                                    |            0  |              0  |                     0  |           0  |           1  |  00:00:00  |
|  URAM Register                                    |            0  |              0  |                     0  |           0  |           1  |  00:00:00  |
|  Dynamic/Static Region Interface Net Replication  |            0  |              0  |                     0  |           0  |           1  |  00:00:00  |
|  Total                                            |            0  |              2  |                     2  |           0  |           8  |  00:00:00  |
-----------------------------------------------------------------------------------------------------------------------------------------------------------


Phase 2.3.1 Physical Synthesis In Placer | Checksum: 1b3e0dc0b

Time (s): cpu = 00:00:05 ; elapsed = 00:00:03 . Memory (MB): peak = 1850.180 ; gain = 0.000
Phase 2.3 Global Placement Core | Checksum: 249ff598c

Time (s): cpu = 00:00:05 ; elapsed = 00:00:03 . Memory (MB): peak = 1850.180 ; gain = 0.000
Phase 2 Global Placement | Checksum: 249ff598c

Time (s): cpu = 00:00:05 ; elapsed = 00:00:03 . Memory (MB): peak = 1850.180 ; gain = 0.000

Phase 3 Detail Placement

Phase 3.1 Commit Multi Column Macros
Phase 3.1 Commit Multi Column Macros | Checksum: 20fdce2e1

Time (s): cpu = 00:00:05 ; elapsed = 00:00:03 . Memory (MB): peak = 1850.180 ; gain = 0.000

Phase 3.2 Commit Most Macros & LUTRAMs
Phase 3.2 Commit Most Macros & LUTRAMs | Checksum: be72f45d

Time (s): cpu = 00:00:05 ; elapsed = 00:00:03 . Memory (MB): peak = 1850.180 ; gain = 0.000

Phase 3.3 Area Swap Optimization
Phase 3.3 Area Swap Optimization | Checksum: 12bb0fe0d

Time (s): cpu = 00:00:05 ; elapsed = 00:00:03 . Memory (MB): peak = 1850.180 ; gain = 0.000

Phase 3.4 Pipeline Register Optimization
Phase 3.4 Pipeline Register Optimization | Checksum: 165df88e5

Time (s): cpu = 00:00:05 ; elapsed = 00:00:03 . Memory (MB): peak = 1850.180 ; gain = 0.000

Phase 3.5 Small Shape Detail Placement
Phase 3.5 Small Shape Detail Placement | Checksum: 1eb87f9d9

Time (s): cpu = 00:00:06 ; elapsed = 00:00:03 . Memory (MB): peak = 1850.180 ; gain = 0.000

Phase 3.6 Re-assign LUT pins
Phase 3.6 Re-assign LUT pins | Checksum: 127564689

Time (s): cpu = 00:00:06 ; elapsed = 00:00:04 . Memory (MB): peak = 1850.180 ; gain = 0.000

Phase 3.7 Pipeline Register Optimization
Phase 3.7 Pipeline Register Optimization | Checksum: c924dc87

Time (s): cpu = 00:00:06 ; elapsed = 00:00:04 . Memory (MB): peak = 1850.180 ; gain = 0.000
Phase 3 Detail Placement | Checksum: c924dc87

Time (s): cpu = 00:00:06 ; elapsed = 00:00:04 . Memory (MB): peak = 1850.180 ; gain = 0.000

Phase 4 Post Placement Optimization and Clean-Up

Phase 4.1 Post Commit Optimization
INFO: [Timing 38-35] Done setting XDC timing constraints.

Phase 4.1.1 Post Placement Optimization
Post Placement Optimization Initialization | Checksum: e15779b6

Phase 4.1.1.1 BUFG Insertion

Starting Physical Synthesis Task

Phase 1 Physical Synthesis Initialization
INFO: [Physopt 32-721] Multithreading enabled for phys_opt_design using a maximum of 2 CPUs
INFO: [Physopt 32-619] Estimated Timing Summary | WNS=0.789 | TNS=0.000 |
Phase 1 Physical Synthesis Initialization | Checksum: 147570e72

Time (s): cpu = 00:00:00 ; elapsed = 00:00:00.059 . Memory (MB): peak = 1850.180 ; gain = 0.000
INFO: [Place 46-56] BUFG insertion identified 0 candidate nets. Inserted BUFG: 0, Replicated BUFG Driver: 0, Skipped due to Placement/Routing Conflicts: 0, Skipped due to Timing Degradation: 0, Skipped due to Illegal Netlist: 0.
Ending Physical Synthesis Task | Checksum: e62b254f

Time (s): cpu = 00:00:00 ; elapsed = 00:00:00.065 . Memory (MB): peak = 1850.180 ; gain = 0.000
Phase 4.1.1.1 BUFG Insertion | Checksum: e15779b6

Time (s): cpu = 00:00:06 ; elapsed = 00:00:04 . Memory (MB): peak = 1850.180 ; gain = 0.000
INFO: [Place 30-746] Post Placement Timing Summary WNS=0.789. For the most accurate timing information please run report_timing.

Time (s): cpu = 00:00:07 ; elapsed = 00:00:04 . Memory (MB): peak = 1850.180 ; gain = 0.000
Phase 4.1 Post Commit Optimization | Checksum: 15a703d01

Time (s): cpu = 00:00:07 ; elapsed = 00:00:04 . Memory (MB): peak = 1850.180 ; gain = 0.000

Phase 4.2 Post Placement Cleanup
Phase 4.2 Post Placement Cleanup | Checksum: 15a703d01

Time (s): cpu = 00:00:07 ; elapsed = 00:00:04 . Memory (MB): peak = 1850.180 ; gain = 0.000

Phase 4.3 Placer Reporting

Phase 4.3.1 Print Estimated Congestion
INFO: [Place 30-612] Post-Placement Estimated Congestion 
 ____________________________________________________
|           | Global Congestion | Short Congestion  |
| Direction | Region Size       | Region Size       |
|___________|___________________|___________________|
|      North|                1x1|                1x1|
|___________|___________________|___________________|
|      South|                1x1|                1x1|
|___________|___________________|___________________|
|       East|                1x1|                1x1|
|___________|___________________|___________________|
|       West|                1x1|                1x1|
|___________|___________________|___________________|

Phase 4.3.1 Print Estimated Congestion | Checksum: 15a703d01

Time (s): cpu = 00:00:07 ; elapsed = 00:00:04 . Memory (MB): peak = 1850.180 ; gain = 0.000
Phase 4.3 Placer Reporting | Checksum: 15a703d01

Time (s): cpu = 00:00:07 ; elapsed = 00:00:04 . Memory (MB): peak = 1850.180 ; gain = 0.000

Phase 4.4 Final Placement Cleanup
Netlist sorting complete. Time (s): cpu = 00:00:00 ; elapsed = 00:00:00.001 . Memory (MB): peak = 1850.180 ; gain = 0.000

Time (s): cpu = 00:00:07 ; elapsed = 00:00:04 . Memory (MB): peak = 1850.180 ; gain = 0.000
Phase 4 Post Placement Optimization and Clean-Up | Checksum: 15de899b7

Time (s): cpu = 00:00:07 ; elapsed = 00:00:04 . Memory (MB): peak = 1850.180 ; gain = 0.000
Ending Placer Task | Checksum: 604b64df

Time (s): cpu = 00:00:07 ; elapsed = 00:00:04 . Memory (MB): peak = 1850.180 ; gain = 0.000
INFO: [Common 17-83] Releasing license: Implementation
75 Infos, 20 Warnings, 21 Critical Warnings and 0 Errors encountered.
place_design completed successfully
place_design: Time (s): cpu = 00:00:09 ; elapsed = 00:00:06 . Memory (MB): peak = 1850.180 ; gain = 1.020
INFO: [Timing 38-480] Writing timing data to binary archive.
Writing placer database...
Writing XDEF routing.
Writing XDEF routing logical nets.
Writing XDEF routing special nets.
Write XDEF Complete: Time (s): cpu = 00:00:00 ; elapsed = 00:00:00.164 . Memory (MB): peak = 1850.180 ; gain = 0.000
INFO: [Common 17-1381] The checkpoint 'C:/Users/robdj/Documents/RMIT_2021/CAP_STONE/DVI_PASSTHROUGH_CAPS/Working_HDMI_passthrough/Working_HDMI_passthrough.runs/impl_1/dvi_pass_top_placed.dcp' has been generated.
INFO: [runtcl-4] Executing : report_io -file dvi_pass_top_io_placed.rpt
report_io: Time (s): cpu = 00:00:00 ; elapsed = 00:00:00.050 . Memory (MB): peak = 1850.180 ; gain = 0.000
INFO: [runtcl-4] Executing : report_utilization -file dvi_pass_top_utilization_placed.rpt -pb dvi_pass_top_utilization_placed.pb
INFO: [runtcl-4] Executing : report_control_sets -verbose -file dvi_pass_top_control_sets_placed.rpt
report_control_sets: Time (s): cpu = 00:00:00 ; elapsed = 00:00:00.006 . Memory (MB): peak = 1850.180 ; gain = 0.000
Command: phys_opt_design
Attempting to get a license for feature 'Implementation' and/or device 'xc7z020'
INFO: [Common 17-349] Got license for feature 'Implementation' and/or device 'xc7z020'
INFO: [Vivado_Tcl 4-383] Design worst setup slack (WNS) is greater than or equal to 0.000 ns. Skipping all physical synthesis optimizations.
INFO: [Vivado_Tcl 4-232] No setup violation found. The netlist was not modified.
INFO: [Common 17-83] Releasing license: Implementation
84 Infos, 20 Warnings, 21 Critical Warnings and 0 Errors encountered.
phys_opt_design completed successfully
INFO: [Timing 38-480] Writing timing data to binary archive.
Writing placer database...
Writing XDEF routing.
Writing XDEF routing logical nets.
Writing XDEF routing special nets.
Write XDEF Complete: Time (s): cpu = 00:00:00 ; elapsed = 00:00:00.173 . Memory (MB): peak = 1856.398 ; gain = 6.219
INFO: [Common 17-1381] The checkpoint 'C:/Users/robdj/Documents/RMIT_2021/CAP_STONE/DVI_PASSTHROUGH_CAPS/Working_HDMI_passthrough/Working_HDMI_passthrough.runs/impl_1/dvi_pass_top_physopt.dcp' has been generated.
Command: route_design
Attempting to get a license for feature 'Implementation' and/or device 'xc7z020'
INFO: [Common 17-349] Got license for feature 'Implementation' and/or device 'xc7z020'
Running DRC as a precondition to command route_design
INFO: [DRC 23-27] Running DRC with 2 threads
INFO: [Vivado_Tcl 4-198] DRC finished with 0 Errors
INFO: [Vivado_Tcl 4-199] Please refer to the DRC report (report_drc) for more information.


Starting Routing Task
INFO: [Route 35-254] Multithreading enabled for route_design using a maximum of 2 CPUs
Checksum: PlaceDB: 2358886a ConstDB: 0 ShapeSum: 3cf2dc75 RouteDB: 0

Phase 1 Build RT Design
Phase 1 Build RT Design | Checksum: 19148117e

Time (s): cpu = 00:00:28 ; elapsed = 00:00:24 . Memory (MB): peak = 1965.449 ; gain = 95.965
Post Restoration Checksum: NetGraph: d56149c1 NumContArr: bbe6c7bd Constraints: 0 Timing: 0

Phase 2 Router Initialization

Phase 2.1 Create Timer
Phase 2.1 Create Timer | Checksum: 19148117e

Time (s): cpu = 00:00:28 ; elapsed = 00:00:24 . Memory (MB): peak = 1965.449 ; gain = 95.965

Phase 2.2 Fix Topology Constraints
Phase 2.2 Fix Topology Constraints | Checksum: 19148117e

Time (s): cpu = 00:00:28 ; elapsed = 00:00:24 . Memory (MB): peak = 1971.691 ; gain = 102.207

Phase 2.3 Pre Route Cleanup
Phase 2.3 Pre Route Cleanup | Checksum: 19148117e

Time (s): cpu = 00:00:28 ; elapsed = 00:00:24 . Memory (MB): peak = 1971.691 ; gain = 102.207
 Number of Nodes with overlaps = 0

Phase 2.4 Update Timing
Phase 2.4 Update Timing | Checksum: 155d3a406

Time (s): cpu = 00:00:29 ; elapsed = 00:00:25 . Memory (MB): peak = 1992.062 ; gain = 122.578
INFO: [Route 35-416] Intermediate Timing Summary | WNS=0.721  | TNS=0.000  | WHS=-0.197 | THS=-9.675 |

Phase 2 Router Initialization | Checksum: 1e44e8516

Time (s): cpu = 00:00:29 ; elapsed = 00:00:25 . Memory (MB): peak = 1992.062 ; gain = 122.578

Router Utilization Summary
  Global Vertical Routing Utilization    = 0.00103552 %
  Global Horizontal Routing Utilization  = 0.000338066 %
  Routable Net Status*
  *Does not include unroutable nets such as driverless and loadless.
  Run report_route_status for detailed report.
  Number of Failed Nets               = 1102
    (Failed Nets is the sum of unrouted and partially routed nets)
  Number of Unrouted Nets             = 1102
  Number of Partially Routed Nets     = 0
  Number of Node Overlaps             = 0


Phase 3 Initial Routing

Phase 3.1 Global Routing
Phase 3.1 Global Routing | Checksum: 1e44e8516

Time (s): cpu = 00:00:29 ; elapsed = 00:00:25 . Memory (MB): peak = 1992.062 ; gain = 122.578
Phase 3 Initial Routing | Checksum: 124b1ecad

Time (s): cpu = 00:00:30 ; elapsed = 00:00:25 . Memory (MB): peak = 1992.062 ; gain = 122.578

Phase 4 Rip-up And Reroute

Phase 4.1 Global Iteration 0
 Number of Nodes with overlaps = 95
 Number of Nodes with overlaps = 9
 Number of Nodes with overlaps = 1
 Number of Nodes with overlaps = 0
INFO: [Route 35-416] Intermediate Timing Summary | WNS=0.758  | TNS=0.000  | WHS=N/A    | THS=N/A    |

Phase 4.1 Global Iteration 0 | Checksum: 1883874b7

Time (s): cpu = 00:00:30 ; elapsed = 00:00:26 . Memory (MB): peak = 1992.062 ; gain = 122.578
Phase 4 Rip-up And Reroute | Checksum: 1883874b7

Time (s): cpu = 00:00:30 ; elapsed = 00:00:26 . Memory (MB): peak = 1992.062 ; gain = 122.578

Phase 5 Delay and Skew Optimization

Phase 5.1 Delay CleanUp
Phase 5.1 Delay CleanUp | Checksum: 1883874b7

Time (s): cpu = 00:00:30 ; elapsed = 00:00:26 . Memory (MB): peak = 1992.062 ; gain = 122.578

Phase 5.2 Clock Skew Optimization
Phase 5.2 Clock Skew Optimization | Checksum: 1883874b7

Time (s): cpu = 00:00:30 ; elapsed = 00:00:26 . Memory (MB): peak = 1992.062 ; gain = 122.578
Phase 5 Delay and Skew Optimization | Checksum: 1883874b7

Time (s): cpu = 00:00:30 ; elapsed = 00:00:26 . Memory (MB): peak = 1992.062 ; gain = 122.578

Phase 6 Post Hold Fix

Phase 6.1 Hold Fix Iter

Phase 6.1.1 Update Timing
Phase 6.1.1 Update Timing | Checksum: 1650133c7

Time (s): cpu = 00:00:30 ; elapsed = 00:00:26 . Memory (MB): peak = 1992.062 ; gain = 122.578
INFO: [Route 35-416] Intermediate Timing Summary | WNS=0.913  | TNS=0.000  | WHS=0.044  | THS=0.000  |

Phase 6.1 Hold Fix Iter | Checksum: 1650133c7

Time (s): cpu = 00:00:30 ; elapsed = 00:00:26 . Memory (MB): peak = 1992.062 ; gain = 122.578
Phase 6 Post Hold Fix | Checksum: 1650133c7

Time (s): cpu = 00:00:30 ; elapsed = 00:00:26 . Memory (MB): peak = 1992.062 ; gain = 122.578

Phase 7 Route finalize

Router Utilization Summary
  Global Vertical Routing Utilization    = 0.20146 %
  Global Horizontal Routing Utilization  = 0.164723 %
  Routable Net Status*
  *Does not include unroutable nets such as driverless and loadless.
  Run report_route_status for detailed report.
  Number of Failed Nets               = 0
    (Failed Nets is the sum of unrouted and partially routed nets)
  Number of Unrouted Nets             = 0
  Number of Partially Routed Nets     = 0
  Number of Node Overlaps             = 0

Phase 7 Route finalize | Checksum: 13a25ab2e

Time (s): cpu = 00:00:30 ; elapsed = 00:00:26 . Memory (MB): peak = 1992.062 ; gain = 122.578

Phase 8 Verifying routed nets

 Verification completed successfully
Phase 8 Verifying routed nets | Checksum: 13a25ab2e

Time (s): cpu = 00:00:30 ; elapsed = 00:00:26 . Memory (MB): peak = 1992.062 ; gain = 122.578

Phase 9 Depositing Routes
Phase 9 Depositing Routes | Checksum: 1335e4ef6

Time (s): cpu = 00:00:30 ; elapsed = 00:00:26 . Memory (MB): peak = 1992.062 ; gain = 122.578

Phase 10 Post Router Timing
INFO: [Route 35-57] Estimated Timing Summary | WNS=0.913  | TNS=0.000  | WHS=0.044  | THS=0.000  |

INFO: [Route 35-327] The final timing numbers are based on the router estimated timing analysis. For a complete and accurate timing signoff, please run report_timing_summary.
Phase 10 Post Router Timing | Checksum: 1335e4ef6

Time (s): cpu = 00:00:30 ; elapsed = 00:00:26 . Memory (MB): peak = 1992.062 ; gain = 122.578
INFO: [Route 35-16] Router Completed Successfully

Time (s): cpu = 00:00:30 ; elapsed = 00:00:26 . Memory (MB): peak = 1992.062 ; gain = 122.578

Routing Is Done.
INFO: [Common 17-83] Releasing license: Implementation
98 Infos, 20 Warnings, 21 Critical Warnings and 0 Errors encountered.
route_design completed successfully
route_design: Time (s): cpu = 00:00:32 ; elapsed = 00:00:28 . Memory (MB): peak = 1992.062 ; gain = 135.664
INFO: [Timing 38-480] Writing timing data to binary archive.
Writing placer database...
Writing XDEF routing.
Writing XDEF routing logical nets.
Writing XDEF routing special nets.
Write XDEF Complete: Time (s): cpu = 00:00:01 ; elapsed = 00:00:00.224 . Memory (MB): peak = 2000.605 ; gain = 8.543
INFO: [Common 17-1381] The checkpoint 'C:/Users/robdj/Documents/RMIT_2021/CAP_STONE/DVI_PASSTHROUGH_CAPS/Working_HDMI_passthrough/Working_HDMI_passthrough.runs/impl_1/dvi_pass_top_routed.dcp' has been generated.
INFO: [runtcl-4] Executing : report_drc -file dvi_pass_top_drc_routed.rpt -pb dvi_pass_top_drc_routed.pb -rpx dvi_pass_top_drc_routed.rpx
Command: report_drc -file dvi_pass_top_drc_routed.rpt -pb dvi_pass_top_drc_routed.pb -rpx dvi_pass_top_drc_routed.rpx
INFO: [IP_Flow 19-1839] IP Catalog is up to date.
INFO: [DRC 23-27] Running DRC with 2 threads
INFO: [Coretcl 2-168] The results of DRC are in file C:/Users/robdj/Documents/RMIT_2021/CAP_STONE/DVI_PASSTHROUGH_CAPS/Working_HDMI_passthrough/Working_HDMI_passthrough.runs/impl_1/dvi_pass_top_drc_routed.rpt.
report_drc completed successfully
INFO: [runtcl-4] Executing : report_methodology -file dvi_pass_top_methodology_drc_routed.rpt -pb dvi_pass_top_methodology_drc_routed.pb -rpx dvi_pass_top_methodology_drc_routed.rpx
Command: report_methodology -file dvi_pass_top_methodology_drc_routed.rpt -pb dvi_pass_top_methodology_drc_routed.pb -rpx dvi_pass_top_methodology_drc_routed.rpx
INFO: [Timing 38-35] Done setting XDC timing constraints.
INFO: [DRC 23-133] Running Methodology with 2 threads
INFO: [Coretcl 2-1520] The results of Report Methodology are in file C:/Users/robdj/Documents/RMIT_2021/CAP_STONE/DVI_PASSTHROUGH_CAPS/Working_HDMI_passthrough/Working_HDMI_passthrough.runs/impl_1/dvi_pass_top_methodology_drc_routed.rpt.
report_methodology completed successfully
INFO: [runtcl-4] Executing : report_power -file dvi_pass_top_power_routed.rpt -pb dvi_pass_top_power_summary_routed.pb -rpx dvi_pass_top_power_routed.rpx
Command: report_power -file dvi_pass_top_power_routed.rpt -pb dvi_pass_top_power_summary_routed.pb -rpx dvi_pass_top_power_routed.rpx
INFO: [Timing 38-35] Done setting XDC timing constraints.
Running Vector-less Activity Propagation...

Finished Running Vector-less Activity Propagation
110 Infos, 20 Warnings, 21 Critical Warnings and 0 Errors encountered.
report_power completed successfully
INFO: [runtcl-4] Executing : report_route_status -file dvi_pass_top_route_status.rpt -pb dvi_pass_top_route_status.pb
INFO: [runtcl-4] Executing : report_timing_summary -max_paths 10 -file dvi_pass_top_timing_summary_routed.rpt -pb dvi_pass_top_timing_summary_routed.pb -rpx dvi_pass_top_timing_summary_routed.rpx -warn_on_violation 
INFO: [Timing 38-91] UpdateTimingParams: Speed grade: -1, Delay Type: min_max.
INFO: [Timing 38-191] Multithreading enabled for timing update using a maximum of 2 CPUs
INFO: [runtcl-4] Executing : report_incremental_reuse -file dvi_pass_top_incremental_reuse_routed.rpt
INFO: [Vivado_Tcl 4-1062] Incremental flow is disabled. No incremental reuse Info to report.
INFO: [runtcl-4] Executing : report_clock_utilization -file dvi_pass_top_clock_utilization_routed.rpt
INFO: [runtcl-4] Executing : report_bus_skew -warn_on_violation -file dvi_pass_top_bus_skew_routed.rpt -pb dvi_pass_top_bus_skew_routed.pb -rpx dvi_pass_top_bus_skew_routed.rpx
INFO: [Timing 38-91] UpdateTimingParams: Speed grade: -1, Delay Type: min_max.
INFO: [Timing 38-191] Multithreading enabled for timing update using a maximum of 2 CPUs
INFO: [Common 17-206] Exiting Vivado at Wed May 19 14:46:46 2021...

*** Running vivado
    with args -log dvi_pass_top.vdi -applog -m64 -product Vivado -messageDb vivado.pb -mode batch -source dvi_pass_top.tcl -notrace



****** Vivado v2020.2 (64-bit)
  **** SW Build 3064766 on Wed Nov 18 09:12:45 MST 2020
  **** IP Build 3064653 on Wed Nov 18 14:17:31 MST 2020
    ** Copyright 1986-2020 Xilinx, Inc. All Rights Reserved.

source dvi_pass_top.tcl -notrace
Command: open_checkpoint dvi_pass_top_routed.dcp

Starting open_checkpoint Task

Time (s): cpu = 00:00:00 ; elapsed = 00:00:00.043 . Memory (MB): peak = 1118.812 ; gain = 0.000
CRITICAL WARNING: [Board 49-67] The board_part definition was not found for digilentinc.com:arty-z7-20:part0:1.0. This can happen sometimes when you use custom board part. You can resolve this issue by setting 'board.repoPaths' parameter, pointing to the location of custom board files. Valid board_part values can be retrieved with the 'get_board_parts' Tcl command.
CRITICAL WARNING: [Board 49-67] The board_part definition was not found for digilentinc.com:arty-z7-20:part0:1.0. This can happen sometimes when you use custom board part. You can resolve this issue by setting 'board.repoPaths' parameter, pointing to the location of custom board files. Valid board_part values can be retrieved with the 'get_board_parts' Tcl command.
INFO: [Device 21-403] Loading part xc7z020clg400-1
Netlist sorting complete. Time (s): cpu = 00:00:00 ; elapsed = 00:00:00.012 . Memory (MB): peak = 1118.812 ; gain = 0.000
INFO: [Netlist 29-17] Analyzing 73 Unisim elements for replacement
INFO: [Netlist 29-28] Unisim Transformation completed in 0 CPU seconds
INFO: [Project 1-479] Netlist was created with Vivado 2020.2
INFO: [Project 1-570] Preparing netlist for logic optimization
INFO: [Timing 38-478] Restoring timing data from binary archive.
INFO: [Timing 38-479] Binary timing data restore complete.
INFO: [Project 1-856] Restoring constraints from binary archive.
INFO: [Project 1-853] Binary constraint restore complete.
Reading XDEF placement.
Reading placer database...
Reading XDEF routing.
Read XDEF File: Time (s): cpu = 00:00:00 ; elapsed = 00:00:00.221 . Memory (MB): peak = 1523.109 ; gain = 4.984
Restored from archive | CPU: 0.000000 secs | Memory: 0.000000 MB |
Finished XDEF File Restore: Time (s): cpu = 00:00:00 ; elapsed = 00:00:00.222 . Memory (MB): peak = 1523.109 ; gain = 4.984
Netlist sorting complete. Time (s): cpu = 00:00:00 ; elapsed = 00:00:00.001 . Memory (MB): peak = 1523.109 ; gain = 0.000
INFO: [Project 1-111] Unisim Transformation Summary:
  A total of 8 instances were transformed.
  IOBUF => IOBUF (IBUF, OBUFT): 2 instances
  RAM32M => RAM32M (RAMD32(x6), RAMS32(x2)): 6 instances

INFO: [Project 1-604] Checkpoint was created with Vivado v2020.2 (64-bit) build 3064766
open_checkpoint: Time (s): cpu = 00:00:18 ; elapsed = 00:00:20 . Memory (MB): peak = 1523.109 ; gain = 404.297
Command: write_bitstream -force dvi_pass_top.bit
Attempting to get a license for feature 'Implementation' and/or device 'xc7z020'
INFO: [Common 17-349] Got license for feature 'Implementation' and/or device 'xc7z020'
Running DRC as a precondition to command write_bitstream
INFO: [IP_Flow 19-234] Refreshing IP repositories
INFO: [IP_Flow 19-1704] No user IP repositories specified
INFO: [IP_Flow 19-2313] Loaded Vivado IP repository 'C:/Xilinx/Vivado/2020.2/data/ip'.
INFO: [DRC 23-27] Running DRC with 2 threads
WARNING: [DRC ZPS7-1] PS7 block required: The PS7 cell must be used in this Zynq design in order to enable correct default configuration.
INFO: [Vivado 12-3199] DRC finished with 0 Errors, 1 Warnings
INFO: [Vivado 12-3200] Please refer to the DRC report (report_drc) for more information.
INFO: [Designutils 20-2272] Running write_bitstream with 2 threads.
Loading data files...
Loading site data...
Loading route data...
Processing options...
Creating bitmap...
Creating bitstream...
Writing bitstream ./dvi_pass_top.bit...
INFO: [Vivado 12-1842] Bitgen Completed Successfully.
INFO: [Project 1-120] WebTalk data collection is mandatory when using a WebPACK part without a full Vivado license. To see the specific WebTalk data collected for your design, open the usage_statistics_webtalk.html or usage_statistics_webtalk.xml file in the implementation directory.
INFO: [Common 17-186] 'C:/Users/robdj/Documents/RMIT_2021/CAP_STONE/DVI_PASSTHROUGH_CAPS/Working_HDMI_passthrough/Working_HDMI_passthrough.runs/impl_1/usage_statistics_webtalk.xml' has been successfully sent to Xilinx on Wed May 19 14:47:56 2021. For additional details about this file, please refer to the WebTalk help file at C:/Xilinx/Vivado/2020.2/doc/webtalk_introduction.html.
INFO: [Common 17-83] Releasing license: Implementation
23 Infos, 1 Warnings, 2 Critical Warnings and 0 Errors encountered.
write_bitstream completed successfully
write_bitstream: Time (s): cpu = 00:00:17 ; elapsed = 00:00:22 . Memory (MB): peak = 2034.586 ; gain = 511.477
INFO: [Common 17-206] Exiting Vivado at Wed May 19 14:47:56 2021...
